{
  "generated_at": "2026-06-10T07:51:20+00:00",
  "lint": {
    "local_checks_pr": "unavailable",
    "mypy": "passed",
    "ruff": "passed"
  },
  "run": {
    "commit": null,
    "run_id": null,
    "workflow": null
  },
  "schema_checks": {
    "config_manager_usage": "passed",
    "governance_event_schema": "passed",
    "logging_domains": "passed",
    "no_local_paths": "failed"
  },
  "schema_version": "1.0"
}
